index,target,text,label,background
1217,Legalization_of_Abortion,Listening to @reggielittlejhn speak about her work leading #WomensRights Without Frontiers. So inspiring! @AUL @JeanneaneMaxon #SemST,NONE,"The sentence provided does not directly relate to the topic of the legalization of abortion. However, relevant background information from the provided text includes the existence of advocacy networks like ASAP that focus on promoting women's abortion rights, autonomy, and dignity on a global scale. Additionally, youth champions trained by ASAP have successfully addressed issues related to disability rights, contributing to the broader movement for sexual and reproductive rights within the context of human rights. This information highlights the interconnectedness of various social justice movements and the importance of collaborative efforts in advancing women's rights."
1218,Legalization_of_Abortion,What doesn't reduce abortions: -Making it illegal  What does: -Sex education  -Caring about the pregnant person... #SemST,FAVOR,"The sentence ""Legalizing abortion is essential"" can be expanded to ""Advocating for the legalization of abortion is crucial in the ongoing debate surrounding a person's right to choose whether to terminate a pregnancy or not. Restricting access to safe and legal abortion services could have detrimental effects on women's health and well-being."" The background information related to the topic highlights the complex and contentious nature of the abortion debate, with arguments regarding exemptions for cases of sexual assault or fetal abnormalities, the impact of unsafe abortions on individuals and families, and the importance of safe abortion services in protecting women's rights and access to healthcare."
1219,Legalization_of_Abortion,They know what's best for their health They know what's best for their happiness They know what's best for their well being.. #SemST,FAVOR,"The sentence refers to the advocacy for the legalization of abortion, encompassing a movement that fights for women's right to choose abortion without facing legal or social consequences. This movement has involved urging women to empower themselves in making decisions about their sexual and reproductive health. A notable initiative in this regard is the #ShoutYourAbortion hashtag used to share positive abortion experiences and challenge the stigma surrounding abortion. Organizations like ASAP work towards providing safe and accessible abortion services, emphasizing the importance of consent from medical professionals. The overall aim is to ensure women have autonomy over their reproductive choices and access to essential healthcare services."
1220,Legalization_of_Abortion,Changing the cis-nomative atmosphere is difficult.  #SemST,NONE,"The legalization of abortion is a contentious issue, with arguments for both liberalizing and restricting access to legal abortion services. Terminology in the debate plays a significant role, with political framing terms used to support one's own stance and discredit opposing views. Advocates challenging anti-abortion laws highlight the negative consequences and seek to bring attention to the various aspects that need to change in order to protect women's rights."
1221,Legalization_of_Abortion,I can't stand people who are pro life because they had a stillborn or loss.... #SemST,FAVOR,"The statement against the anti-abortion movement highlights the moral responsibility of a woman who chooses to terminate a pregnancy, regardless of the circumstances. The call for exemptions in abortion laws for cases of sexual assault or poor quality of life for the baby reflects a push for more nuanced legislation. The differentiation between murder and abortion under the Infant Life Preservation Act is crucial in the legal context. The belief in autonomous, affordable, and effective access to pregnancy termination is a key tenet of the stance advocating for the legalization of abortion."
1222,Legalization_of_Abortion,"@CrushTheCFR Yes, heard you the first 500 times you tweeted SIX kids. she is probably also #SemST",NONE,"The sentence ""thrice guilty is he who drove her to the desperation which impelled her to the crime"" refers to the idea that those who push women to desperate measures, such as illegal abortions, are also responsible. Stella Browne was a prominent advocate for birth control in the 1930s who later became involved in advocating for abortion rights. The use of the hashtag #ShoutYourAbortion on social media reflects a movement to challenge the stigma surrounding abortion and encourage women to share their experiences publicly. The inclusion of countries like Afghanistan, Thailand, China, and Lebanon in the discussion highlights how abortion rights are a global issue."
1223,Legalization_of_Abortion,We must provide demonstrated sexual training as a preparation for marriage. From THE COMING WOMAN #sexed #marriage #books #SemST,NONE,"The mentioned text seems to be discussing the complex network of individuals and organizations advocating for sexual and reproductive rights, including issues like abortion. Browne's beliefs were influenced by prominent sexologists, encouraging women to take control of their own health and sexuality. Organizations like ASAP have trained youth champions to address various human rights issues, including disability rights. Womenlink and Women with Disabilities Empathy are among the groups involved in advancing reproductive and sexual rights. This information may offer background context on the diverse efforts and perspectives related to the legalization of abortion."
1224,Legalization_of_Abortion,@EmilyBeaulieu1 maybe that's what he wants #SemST,NONE,"In the context of the legalization of abortion, it is crucial to understand the various advocacy efforts and support networks that have emerged. For example, the Asia Safe Abortion Partnership (ASAP) plays a significant role in ensuring safe and accessible abortions, addressing the stigma surrounding the procedure. Additionally, movements like #ShoutYourAbortion aim to empower women to share their stories and combat societal taboos. Collaboration between advocacy groups, such as Together for Yes, underscores the collective effort needed to drive policy change and promote reproductive rights globally."
1225,Legalization_of_Abortion,She*  knows what's best for her* happiness & her* body #SemST,FAVOR,"Based on the provided information from Wikipedia, the movement for the legalization of abortion aims to secure the right for women to choose to have an abortion free from legal and social repercussions. Stella Browne, a prominent birth control advocate in the 1930s, expanded her advocacy to include abortion rights, believing that working women should have the ability to control their pregnancies even in challenging circumstances. This advocacy work emphasizes the importance of women having agency over their own bodies and reproductive choices. Additionally, the organization supporting this cause promotes women's rights to equality, dignity, and privacy without facing discrimination."
1226,Legalization_of_Abortion,@Niall250 good thing is that #DUP have consistently said ALL murder was + is wrong. SF were pro murder...still are. #SemST,AGAINST,"Based on the information related to the topic of the legalization of abortion in Ireland and Northern Ireland, it is important to note that several political parties, such as Sinn Féin, the Labour Party, Social Democrats, Green Party, Communist Party, Socialist Party, and Irish Republican Socialist Party, have officially declared their support for abortion rights. On the other hand, mainstream center-right parties like Fianna Fáil and Fine Gael do not have official stances on abortion but allow conscience votes in certain circumstances. Aontú, a party founded in January 2019, takes an anti-abortion stance, emphasizing the protection of the right to life. The movements towards legalizing abortion involved proposals to repeal the 8th Amendment, provide unrestricted access to abortion for the first 12 weeks of pregnancy, and allow no-term limits for specific cases like fatal foetal abnormalities, rape, and incest. The campaign for repeal involved a coalition of groups like Together for Yes, the National Women's Council of Ireland, and the Abortion Rights Campaign in a referendum."
1227,Legalization_of_Abortion,words are meant to trigger strong emotional responses as well as to the medical inaccuracies & misogyny.. #SemST,NONE,"The sentence provided seems to be discussing the importance of framing terminologies to support one's stance on abortion legalization. The background information related to this topic includes how activists have used social media, such as the hashtag #ShoutYourAbortion, to denounce the stigma around abortion and highlight the negative consequences that can result from lack of access. The activism also aimed to emphasize the risks to the mental and physical health of pregnant women, the fetus, and the evidence of extreme fetal abnormality to support the legalization of abortion based on various grounds."
1228,Legalization_of_Abortion,You know what's best You know what's best for your well being You know what's best for your life... # #SemST,NONE,"The movement for the legalization of abortion aims to grant women the right to choose to terminate a pregnancy without the risk of facing legal or social consequences. Organizations such as ASAP (Abortion-rights Advocate Groups) work towards ensuring safe and accessible abortions through educational and advocacy efforts. These groups, such as the Center for Health and Social Change, Femidangdang, Femimonsters, and Flaming Feminist Action, advocate for women's rights to equality, dignity, respect for their private lives, and access to affordable and effective termination of pregnancy at any time during pregnancy."
1229,Legalization_of_Abortion,"As good a time as any to say: when too many men are adjudicating on women's reproductive systems, the results are never good #Rape #SemST",FAVOR,"The sentence provided highlights the importance of providing exemptions in abortion laws for cases of sexual assault or when a baby may not have a good quality of life. This aligns with the ongoing fight for women's rights, particularly in relation to abortion. It's crucial to ensure that legalizing abortion is accompanied by accessible healthcare for women in need, as seen in the challenges faced in Asia despite legal status. The example of the fourteen-year-old girl's case underscores the necessity of such exemptions in abortion laws."
1230,Legalization_of_Abortion,Thank you @PPact for treating me with kindness & respect & TLC during my wellness exam. #womenshealth #yaycondoms #SemST,NONE,"The background information related to the text on the legalization of abortion includes a movement advocating for access to birth control information for women, empowerment of women regarding their sexual health decisions, promotion of sharing positive abortion experiences on social media, and the existence of the Asia Safe Abortion Partnership (ASAP) which aims to increase accessibility to safe and legal abortion services. Additionally, ASAP engages in educational and advocacy work on various relevant issues such as menstrual management, violence against women, and unplanned pregnancies to ensure women's rights to equality, dignity, and privacy without discrimination."
1231,Legalization_of_Abortion,"Your life is worth a lot. Don't believe any ""compassionate"" politicians or doctors or friends who tell you otherwise. You matter. #SemST",AGAINST,"The abbreviations, slang, and hashtags in the sentence can be expanded as follows: The women called for the legalization of abortion and promoted positive abortion experiences by using the hashtag #ShoutYourAbortion online to combat the stigma. Policymakers in some states attempted to restrict abortion services by deeming it non-essential. Globally, there is a strong public support, with a 67% majority in favor of legalizing abortion. Advocates emphasize the importance of ensuring pregnant women have autonomous, affordable, and effective access to abortion as a basic human right."
1232,Legalization_of_Abortion,Bodily autonomy is a human right. A person's access to abortion is a human right. #reprojustice #reprorights #SemST,FAVOR,"The sentence refers to the legalization of abortion, which is a key aspect of the abortion-rights movement, also known as the pro-choice movement. This movement advocates for legal access to induced abortion services, including elective abortion, and aims to support women who wish to terminate their pregnancies without facing legal or social consequences. The movement is rooted in the belief that women should have autonomy over their reproductive choices and access to safe and affordable abortion services."
1233,Legalization_of_Abortion,"@charlescwcooke @HillaryClinton Once they're born, that is. #SemST",NONE,"Experts in the field of abortion rights have advocated for exemptions in abortion laws for cases involving sexual assault and potential poor quality of life for the baby. This has been especially emphasized by the feminist movement spearheaded by the organization ASAP in countries like Afghanistan, Thailand, China, and Lebanon. ASAP has implemented programs like the creation of ""youth champions"" to educate young people on sexual health, reproductive rights, and the abortion rights movement. These advocates stress the importance of ensuring pregnant women have autonomous, affordable, and effective access to abortion services."
1234,Legalization_of_Abortion,"Also, abortion is wrong biblically and morally. Imagine never getting a chance to live your life. Think about where you are now. #SemST",AGAINST,"The sentence ""It is the argument against the anti-abortion movement"" can be expanded as follows: ""The stance being presented is in opposition to the anti-abortion movement, which advocates against the legalization of abortion."" 
Some background information related to this statement could be the historical context of abortion laws, such as the severe punishments that were imposed for seeking or providing abortions in different regions throughout history. This can help frame the discussion around the ongoing debate on the legalization of abortion and the pushback against anti-abortion laws."
1235,Legalization_of_Abortion,Re Last: I can't get past this...why must abortion providers dismember a fetus alive?  That just sounds...hideously inhumane. #SemST,AGAINST,"The sentence ""It is the argument against the anti-abortion movement"" can be expanded to ""The stance on the legalization of abortion opposes the movement that advocates against abortion."" Background information on the topic includes the ongoing debate over induced abortion, with arguments both for and against liberalizing or restricting access to legal abortion services. Polling data shows that individuals may change their stance on abortion based on specific circumstances such as rape, incest, fetal viability, and maternal health. The experts suggest that abortion laws should include provisions for exemptions in cases of sexual assault or potential quality of life issues for the fetus. The ban on abortion has resulted in unsafe self-induced abortions and illegal practices that require attention, and proponents of abortion rights emphasize the importance of autonomous, affordable, and effective access to abortion services for pregnant individuals."
1236,Legalization_of_Abortion,Praise to District Court Judge Larry Hendricks for blocking that ridiculous anti-abortion law in Kansas #SemST,FAVOR,"The abbreviation ""abortionists"" in the sentence refers to physicians who provide abortions. The slang term ""ShoutYourAbortion"" mentioned represents a social media campaign launched in response to the defunding of Planned Parenthood. The hashtag ""legal right"" emphasizes the stance that abortion is a legal right for anyone who wants or needs it. In the context of the legalization of abortion, the landmark Roe v. Wade case set a precedent by ruling that a Texas statute forbidding abortion except to save the life of the mother was unconstitutional, thus changing abortion laws in the US."
1237,Legalization_of_Abortion,A little VAN action before work  #datadatadata #SemST,NONE,"The expansion of the abbreviations, slang, and hashtags in the sentence would be: ""In its first year, the Abortion Law Reform Association (ALRA) recruited 35 members, and by 1939 had almost 400 members. Bolton, delivered concurrently. Advocates for Safe and Accessible Abortion Procedures (ASAP) satisfies the demand for safe and accessible abortions through educational and advocacy work, including workshops, journalism, and advocacy on issues related to unplanned pregnancies. The Global Day of Action is a form of protest advocating for climate change awareness.""

Valuable background information related to the topic includes the historical context of ALRA's membership growth and the work of ASAP in providing education and advocacy for safe abortions. Additionally, the mention of the Global Day of Action as a form of protest highlights the ongoing advocacy efforts surrounding reproductive rights and climate change awareness."
1238,Legalization_of_Abortion,@ScottWalker   goes along with the world is the law of God and not of men #SemST,AGAINST,"The sentence ""It is the argument against the anti-abortion movement."" can be elaborated as follows: ""The stance on legalization of abortion opposes the anti-abortion movement, which seeks to restrict women's rights to choose abortion. Advocates of abortion legalization aim to secure women's autonomy in making the decision to abort without facing legal or societal repercussions. This debate often delves into complex ethical and moral considerations surrounding women's reproductive rights.""

Background information from the Wikipedia article includes the historical context of abortion laws, the varied perspectives of different rulers on the issue, and the ongoing advocacy efforts to challenge restrictive abortion bans. It illustrates how discussions around abortion intersect with politics, religion, and women's rights, highlighting the multifaceted nature of the debate."
1239,Legalization_of_Abortion,@m_lonz @LifeNewsHQ Captors have already been born and are no longer part of the body of a pregnant woman. That's the difference. #SemST,FAVOR,"In the context of the legalization of abortion, experts advocating for exemptions in abortion laws often focus on cases of sexual assault or concern for the quality of life of the unborn baby. The Infant Life Preservation Act distinguishes between abortion and murder by defining the act of causing a miscarriage. Laws prohibiting abortions post-quickening are designed to safeguard the well-being of pregnant women rather than solely focusing on fetal life. It's also important to note that various laws have been implemented to restrict specific abortion methods. These discussions reflect differing perspectives on humanitarian rights related to pregnancy termination, emphasizing the importance of autonomous, affordable, and effective access to abortion services."
1240,Legalization_of_Abortion,The right to #choose? Thats a #lie! #babies don't choose to #die! Prolifeyouthgen #SemST,AGAINST,"The sentence ""Legalization of Abortion"" refers to the advocacy of allowing induced abortion services, including elective abortion, to be legally accessible. This stance is central to the abortion-rights movements, also known as pro-choice movements. These movements argue in opposition to the anti-abortion movement and seek to empower women to choose abortion without fear of legal or social repercussions. The initiative ShoutYourAbortion was launched in response to attempts to defund Planned Parenthood, aiming to emphasize that abortion is a legal right for those who seek it."
1241,Legalization_of_Abortion,"It's not #yourbody, so it's not your #choice.youthgen #SemST",FAVOR,"The sentence ""Legalization of Abortion"" can be expanded as follows: Advocating for the legalization of abortion is a stance against the anti-abortion movement, which seeks to grant women the right to choose abortion without facing legal or social repercussions. Despite abortion being legal in Asia, access to quality healthcare during abortions is not always guaranteed. Groups such as the Center for Health and Social Change, Femidangdang, Femimonsters, and Flaming Feminist Action are advocates for abortion rights. The criteria for mental and physical health risks are broad, allowing abortion on demand with the consent of two NHS doctors."
1242,Legalization_of_Abortion,A #person's value is not determined by his #size. #prolifegen #prolifeyouth #SemST,AGAINST,"The movement for the legalization of abortion aims to give women the right to choose to have an abortion without facing legal or social consequences. It is centered around values of liberty, freedom, equality, dignity, and respect for women's private lives. Advocates believe in the autonomy of pregnant women to access safe and affordable abortion services at any point during pregnancy. The issue extends beyond politics and involves various aspects of society, including individuals' peers, authorities, family, friends, and coworkers. Additional related concepts include the pro-choice stance, the anti-abortion movement, reproductive rights, and voluntary childlessness."
1243,Legalization_of_Abortion,Before I formed you in the #womb I knew you. #prolifegen #prolifeyouth #God #SemST,AGAINST,"The abbreviation ""LOE"" likely refers to ""love of ease,"" which could be a motive for seeking abortion according to historical perspectives on the topic. The slang term ""suffering the unborn innocent"" may refer to the emotional distress a woman may feel when considering the option of abortion. The hashtag ""#ChildDestruction"" could possibly relate to the historical term used for taking the life of a viable unborn child. In the United States, the 1960s saw the emergence of an abortion reform movement, which has continued to spark debates and actions like the You Know Me movement in response to legislative developments in several states. The mid-19th century primarily linked concerns about abortion to the risk it posed to a woman's health, reflecting a different perspective compared to contemporary discussions influenced by religious, ethical, and diplomatic considerations."
1244,Legalization_of_Abortion,Even the #smallest #person can change the course of the #future.youthgen #SemST,AGAINST,"The abbreviation ASAP stands for ""Advocates for Youth."" They have created ""youth champions"" to educate their peers on sexual activity, abortions, women's rights, reproductive health, and the abortion rights movement. These champions have been successful in training, including issues related to disability rights, which helps integrate reproductive and sexual rights into the human rights movement. The Global Day of Action is a protest event that aims to raise awareness and promote change for issues like global warming by bringing together various advocate groups with different goals."
1245,Legalization_of_Abortion,The right to control one's body is not a license to kill.Youth #SemST,AGAINST,"The sentence you provided talks about the legalization of abortion. In the context of the campaign to repeal the eighth amendment and legalize abortion in response to cases like Savita Halappanavar's death in 2012, there are ongoing efforts to establish the right for women to choose abortion without facing legal or social repercussions. Despite abortion being legal in some regions like Asia, access to safe and adequate healthcare can still be limited, highlighting the importance of continued advocacy for reproductive rights and access to abortion services."
1246,Legalization_of_Abortion,"Does a #pregnant #woman have 2 heads, 2 hearts, 4 arms, and 4 legs? #prolifeyouth #prolifegen #didntthinkso #SemST",AGAINST,"Based on the provided background information, experts suggest that abortion laws should include exemptions for cases of sexual assault and when the baby's quality of life may be compromised. Organizations advocating for abortion rights, such as the Center for Health and Social Change and Femimonsters, aim to promote access to safe and legal abortions for women. In Great Britain, abortion is allowed up to 24 weeks if it endangers the pregnant woman's life. These facts support the stance on the legalization of abortion and highlight the importance of women's autonomy in making reproductive choices."
1247,Legalization_of_Abortion,The #right to #life should be the #first among #humanrights -Pope Francisyouthgen #SemST,AGAINST,"The text seems to highlight the international advocacy efforts related to abortion rights, particularly in sub-Saharan Africa and the developing world. The organization ASAP plays a significant role in promoting feminist power advocating for women's abortion rights, autonomy, and dignity. On the other hand, Aontú, established in January 2019, is opposed to abortion and focuses on protecting the right to life. This information provides valuable context for understanding the various stances and initiatives surrounding the legalization of abortion on a global scale."
