index,target,text,label,background
1439,Legalization_of_Abortion,I wonder if America will like focus on real issues now #starvingchildren #abuse #nationaldebt #terrorism #SemST,NONE,"The issue of induced abortion is currently a divisive topic around the world, with arguments for both liberalizing and restricting access to legal abortion services. Some policymakers saw the opportunity to declare abortion as non-essential, resulting in the termination of services in twelve states. International organizations are actively working to alter abortion laws and promote family planning services, particularly in developing countries. The persistent feminist movement has led to advocacy efforts for women's abortion rights, addressing issues such as menstrual management and violence against women. The ban on abortion in some regions has led to unsafe self-induced abortions and illegal practices that require urgent attention."
1440,Legalization_of_Abortion,Gay Marriage & Murdering the Unborn will always be a SIN in GODS eyes. #ccot #tcot #jesus #bible. #SemST,AGAINST,"The sentence, ""It is the argument against the anti-abortion movement,"" can be expanded as follows: ""This statement represents a stance opposing the anti-abortion movement."" The background information provided from Wikipedia emphasizes the historical and legal aspects of the abortion debate, including incidents of illegal abortions resulting in tragic deaths and differing views on abortion based on religious beliefs and societal norms. This context highlights the complexity and controversial nature of the legalization of abortion."
1441,Legalization_of_Abortion,"If you're all about equality, then the unborn babies get an equal chance at life too....#EqualityForTheUnborn #SemST",AGAINST,"The text you provided advocates for the legalization of abortion, highlighting the importance of abortion rights for women in various circumstances. The Abortion rights movement emphasizes the need for exemptions in abortion laws, particularly for cases involving sexual assault and where the baby's quality of life may be compromised. These experts champion the belief that pregnant women should have the autonomy, affordability, and accessibility to choose termination of pregnancy. Over time, efforts from political figures have aimed to address disparities in women's rights concerning abortion. This information provides valuable context on the stance supporting the legalization of abortion and the ongoing efforts to uphold women's reproductive rights."
1442,Legalization_of_Abortion,"@nytimes Thanks to anti-choicers, women dealing with this may also face prosecution. #SemST",FAVOR,"The hashtag #ShoutYourAbortion was used by women to share positive abortion experiences online and challenge the stigma surrounding abortion. In South Korea, the abortion ban has resulted in dangerous self-induced abortions and other illegal practices. Despite legal restrictions and harassment, women continue to seek abortions. It is important to consider the lack of access to safe and legal abortion services in certain regions, such as Asia, even where abortion is legal."
1443,Legalization_of_Abortion,"When you abort a baby, you don't just abort one person ...you abort generations. #SemST",AGAINST,"The Abortion rights movement advocates for women's reproductive rights, including the option to terminate a pregnancy at any stage. Certain experts propose exemptions in abortion laws for cases of sexual assault or pregnancies where the baby may not have a good quality of life. The movement aims to reduce the stigma surrounding abortion and promote sharing positive experiences, as seen through the hashtag #ShoutYourAbortion. However, unsafe abortions can have negative impacts beyond just a woman's health, such as increased financial burden on families and reduced productivity for women. In some regions like Asia, although abortion may be legal, access to safe and adequate healthcare services during such procedures may still be limited."
1444,Legalization_of_Abortion,"Abortion is on the wrong side of history: healers, inventors, artists, your wife, your husband, your best friend, all eliminated. #SemST",AGAINST,"The sentence ""It is the argument against the anti-abortion movement"" should be expanded to: ""The sentence refers to the ongoing debate and opposition to the anti-abortion movement."" Background information related to the topic includes the historical context of abortion practices, the involvement of the abortion rights movement in supporting women's choices, the ongoing divisiveness in public opinion on legal access to abortion services, and the use of social media hashtags like #ShoutYourAbortion to reduce stigma. Additionally, the reference to the dangers of unsafe abortions highlights the broader societal and health implications of restrictive abortion laws."
1445,Legalization_of_Abortion,Spent the WHOLE day on my highlight film from my Israel trip...I'll post the link and Instagram the link to it  #ballislife #SemST,NONE,"In 1964, Gerri Santoro of Connecticut tragically died while attempting to get an illegal abortion, which later became a key symbol in the abortion rights movement. The hashtag #ShoutYourAbortion was used by women to share positive abortion experiences online in order to break the stigma surrounding the topic. Various youth champions have received training on issues like disability rights through organizations such as ASAP, contributing to the broader efforts of promoting reproductive and sexual rights as part of the human rights movement. The organization mentioned in the text advocates for women's rights to equality, dignity, and respect without discrimination."
1446,Legalization_of_Abortion,if it wasn't for harry all my favorite characters would still be alive #SemST,NONE,"The legalisation of abortion has a long history with influential figures such as Stella Browne advocating for reproductive rights. Cases like that of a fourteen-year-old girl who received a termination after being raped and the tragic death of Gerri Santoro highlight the risks involved in illegal abortions. The movement for abortion rights has gained momentum over time, with individuals sharing their stories on platforms like Twitter to push for legislative changes."
1447,Legalization_of_Abortion,@CrimsonHotMess don't need your input but thanks. #womanschoice #controlyourownbody #SemST,FAVOR,"The sentence could be expanded as follows: This movement, which advocates for the legalization of abortion, aims to establish a right for women to make the autonomous choice to undergo an abortion procedure without the fear of facing legal repercussions or societal backlash. Lindy West, Amelia Bonow, and Kimberly Morrison launched the #ShoutYourAbortion campaign in 2015 to counter the stigma around abortion and emphasize that it is a legal right for anyone in need. This initiative aimed to empower women to share their positive abortion experiences openly on social media. The movement also emphasizes the importance of women taking control of their reproductive health choices."
1448,Legalization_of_Abortion,"Is #America still ""One Nation Under God"" #violence #racism #samesex #LustWins #populationcontrol #hate #atheism #Secularism #SemST",AGAINST,"The text you provided highlights the varying views on abortion in America, with many self-identifying as ""pro-choice"" or ""pro-life"". Abortion rights advocate groups, such as Center for Health and Social Change, Femidangdang, Femimonsters, and Flaming Feminist Action, play a key role in advocating for reproductive rights. Additionally, different rulers throughout history have had differing perspectives on abortion, influenced by factors such as religion and societal norms. The formation of groups like Together for Yes in Ireland demonstrates the significance of organized campaigns in pushing for legislative change regarding abortion rights.

"
1449,Legalization_of_Abortion,Thanks @Jeffrey_Addison  Kudos to @VolvoCarsAus for caring about the safety of unborn children #auspol #SemST,AGAINST,"The background information related to the legalization of abortion includes the presence of organizations like the Guttmacher Institute, Ipas, and Abortion Access and Information, as well as advocacy groups such as Australia's Women's Abortion Action Campaign and the Abortion Rights Campaign. South Africa allows abortion on demand under the Choice on Termination of Pregnancy Act, which is supported by the Asia Safe Abortion Partnership that works towards ensuring safe and accessible abortions. The presence of abortion bans in some regions has led to dangerous self-induced abortions and illegal practices, highlighting the importance of addressing these issues."
1450,Legalization_of_Abortion,RT @AdvocatesOfLife: RT @ProLifeYouth Adopting a child shouldn't cost more than aborting one.   #adoptionclini... #SemST,AGAINST,"The sentence provided likely expresses support for the legalization of abortion. Amid the argument against the anti-abortion movement, experts are advocating for exceptions in abortion laws, such as for cases of sexual assault or when a baby may face a poor quality of life. Online movements like #ShoutYourAbortion aim to reduce stigma and create a platform for sharing positive abortion experiences. Internationally, organizations focus on altering abortion laws and improving family planning services in regions like sub-Saharan Africa. Arguments supporting abortion rights emphasize the broader impacts of unsafe abortions beyond just women's health, including economic burdens on families. Advocates push for laws that respect the humanitarian rights of pregnant individuals and stress the importance of accessible, affordable, and effective termination of pregnancy options."
1451,Legalization_of_Abortion,On my bday I'm always so grateful to my bio parents who gave me up for #adoption #nochoiceisevereasy #SemST,AGAINST,"The text you provided focuses on the legalization of abortion. This movement advocates for granting women the right to choose to have an abortion without facing legal or social repercussions. It emphasizes the importance of exemptions in abortion laws for situations like sexual assault or cases where the baby's quality of life may be compromised. The ultimate goal is to empower women to make decisions about motherhood and ensure the accessibility, affordability, and effectiveness of termination of pregnancy services throughout all stages of pregnancy."
1452,Legalization_of_Abortion,That's like being into cannibalism but against abortion.comparing being against eggs but loving chicken. #cannibalism #analogy #SemST,AGAINST,"The text you provided could be expanded as follows: ""It is the argument against the anti-abortion movement, which suggests that those supporting the legalization of abortion are in favor of choice and individual freedoms. Polling shows that people's stances on abortion can shift based on factors such as rape, incest, fetal viability, and maternal health. Merely passing anti-abortion laws may not address the underlying issues, as pointed out by the writer who likened it to cutting the top of a weed while the root remains."""
1453,Legalization_of_Abortion,"@FollowFIDF The Gods #Law, the #Truth, is being #supressed! They thing they are eternal! #gaymarriage #LoveWins #SemST",NONE,"The background information related to the text on the legalization of abortion includes arguments against the anti-abortion movement, highlighting the need for advocacy to challenge restrictive laws. Different rulers and countries like Argentina have historically reflected strong religious influences on abortion laws. Advocacy groups like the Center for Health and Social Change and Flaming Feminist Action work towards the rights of women for equality and dignity. This context underscores the societal, religious, and legal complexities surrounding the issue of abortion legalization."
1454,Legalization_of_Abortion,It should never ever be legal to have an abortion because murder is wrong & #AbortionIsMurder not #healthcare . We Must . #SemST,AGAINST,"The sentence ""{text}"" could be expanded as follows: ""The argument seeks to legalize the termination of pregnancies, especially in cases of danger to the mother's health or well-being, or where the fetus has severe abnormalities. The push for legalization is driven by the Abortion rights movement, which advocates for women's autonomy and safety in making decisions about their bodies. The movement gained momentum after the tragic death of Gerri Santoro in 1964 due to an illegal abortion, highlighting the risks women face without access to safe and legal procedures."" This additional information provides context for the sentence and explains the background of the legalization of abortion stance."
1455,Legalization_of_Abortion,"if we can accept that a mother can kill even her own child, how can we tell other people not to kill one another?  #SemST",AGAINST,"The context provided from the Wikipedia information highlights the historical and legal perspective on abortion. It underscored the stance that the act of abortion, regardless of the motive behind it, can be seen as a serious offense leading to severe punishments, such as life imprisonment. Additionally, the text also touches on the importance of women having the right to choose whether to terminate a pregnancy, especially in challenging circumstances. The reference to the negative consequences of unsafe abortions emphasizes the need for legal and safe access to abortion services."
1456,Legalization_of_Abortion,How much do we really believe in equal rights for all mankind? #unborn #LoveWins #followthrough #SCOTUS #roevwade #science #SemST,AGAINST,"The movement for the legalization of abortion aims to secure women's right to choose abortion without facing legal or social repercussions. ShoutYourAbortion was initiated to emphasize that abortion is a legal right that should be accessible to those who need it. Advocates stress the importance of providing pregnant women with autonomous, affordable, and effective options for termination. The ongoing battle for women's reproductive rights has involved various negotiations and debates, with political figures striving to address discrepancies in access to abortion services."
1457,Legalization_of_Abortion,Girls don't want boys. Girls want #SemST,NONE,"The text discusses the movement advocating for the legalization of abortion, emphasizing women's right to choose without facing legal or social consequences. The movement aims to empower women to take control of their reproductive health and sexuality. One notable initiative within the movement includes the use of the #ShoutYourAbortion hashtag to reduce stigma. Additionally, various organizations are working to promote gender equality and non-discrimination against women in all aspects of life."
1458,Legalization_of_Abortion,Mzwakhe mbuli says doctors & nurses are paid assassins.. they kill unborn babies & give it a fancy name #SemST,AGAINST,"The background information provided from the Wikipedia source highlights the challenges faced by women in Africa when seeking induced abortions due to lack of access to trained professionals, resulting in high rates of unsafe abortions. The prevalence of unauthorized ""Black Market"" abortions, often performed by women experienced in childbirth or by midwives and nurses without proper medical training, contributes to the high number of abortion-related complications in the region. This context sheds light on the urgent need for improved access to safe and legal abortion services in Africa to reduce maternal mortality and morbidity."
1459,Legalization_of_Abortion,People aren't 'pro-life' they're 'pro-birth'. When a mother can't provide what happens then? #SemST,FAVOR,"The sentence ""It is the argument against the anti-abortion movement"" refers to a position opposing the efforts of those who advocate against legalized abortion. This stance is often supported by experts who argue for abortion laws to include provisions for cases of sexual assault or when a child's quality of life would be severely impacted. Additionally, considerations for allowing abortion in cases where the mother's life is at risk or the fetus has severe abnormalities are also emphasized by proponents of legal abortion, who advocate for women's reproductive rights to be autonomous, affordable, and easily accessible."
1460,Legalization_of_Abortion,What is it that makes the human race behave in an undignified way to gain attention? #furgison #prideparade #potus #isis #lgbt #SemST,NONE,"Legalization of abortion has sparked advocacy efforts across various platforms from workshops to addressing issues such as violence against women and unplanned pregnancies. Due to abortion bans, there has been a rise in dangerous self-induced procedures and illegal practices, calling for more attention on the matter. In response, a number of abortion-rights advocate groups, such as Center for Health and Social Change and Womenlink, have emerged to fight for women's autonomy and equality in reproductive health."
1461,Legalization_of_Abortion,"I'm pro choice for if you want to kill living babies, go right ahead. #SemST",FAVOR,"The sentence ""advocate for legal access to induced abortion services including elective abortion"" expands to mean that the abortion-rights movements, or pro-choice movements, work to support women's rights to choose to have an abortion. This movement seeks to ensure that women have the freedom to terminate a pregnancy without facing legal or social consequences. This information aligns with the stance of advocating for the legalization of abortion, highlighting the importance of reproductive rights and autonomy for women."
1462,Legalization_of_Abortion,"Just remember, there is a living family out there just waiting to #adopt your aborted baby. #SemST",AGAINST,"The sentence seems to address the contentious issue of legalizing abortion. Drawing from the provided information, the abortion rights movement seeks to advocate for women's freedom to choose to terminate their pregnancy without facing legal or social repercussions. It is important to note that the movement also highlights the need for exemptions in abortion laws for cases of sexual assault or fetal abnormalities. Additionally, the use of hashtags like #ShoutYourAbortion aims to destigmatize the topic and promote sharing positive abortion stories. In some regions where abortion is banned, there is a risk of unsafe self-induced abortions, emphasizing the importance of safe and legal access to abortion services for women."
1463,Legalization_of_Abortion,@forrest_grump Large parts of it were difficult to write so I can't imagine having to read the fucking thing. #SemST,NONE,"The writer's analogy of passing an anti-abortion law as merely ""mowing off the top of the noxious weed, while the root remains"" emphasizes that directly prohibiting abortion may not address the underlying issues leading to unwanted pregnancies. Experts suggest that abortion laws should include exemptions for cases of sexual assault or when the baby's quality of life may be severely affected. TRAP laws, which limit abortion facilities, can make it difficult for women to access abortion services. Additionally, the presence of extreme fetal abnormalities can be a factor in the decision-making process regarding abortion. The ongoing fight for women's reproductive rights, including the ability to choose abortion, involves various stakeholders engaging in negotiations and debates."
1464,Legalization_of_Abortion,What the leftists are doing is putting all Americans in danger! #tcot #UniteBlue #LoveWins #LGBT #SCOTUS #SemST,NONE,"The text refers to the legalization of abortion, which has been a contentious issue. Advocates, such as Lindy West, Amelia Bonow, and Kimberly Morrison, started the ShoutYourAbortion movement to emphasize that abortion is a legal right for those who want or need it. The presence of abortion bans has resulted in dangerous self-induced abortions and illegal practices, prompting advocacy groups like Center for Health and Social Change and Femidangdang to challenge these bans. Social media has played a significant role in amplifying the voices of women and advocating for the repeal of restrictive abortion laws."
1465,Legalization_of_Abortion,Every human person - is a being of inestimable worth created in the image and likeness of God. -St. JPII #SemST,AGAINST,"Based on the provided background information related to the legalization of abortion, it is evident that there are ongoing debates around abortion rights, with historical cases like Gerri Santoro's death fueling the abortion rights movement. The influence of religion, especially the Catholic Church, has played a significant role in shaping societal views on abortion, with Poland being a notable example where abortion is deemed socially unacceptable due to the strong presence of the Catholic Church. The discussion also involves arguments around women's rights, equality, and access to safe and legal abortion services."
1466,Legalization_of_Abortion,@WildChild69 @AnnieJMJ @binghamrk Jesus says to trust him in ALL things not to put trust in men or the world. #SemST,NONE,"The sentence ""The women encouraged other women to share positive abortion experiences online using the hashtag #ShoutYourAbortion in order to denounce the stigma surrounding abortion"" reflects the movement towards empowering women to speak openly about their abortion experiences without fear of judgment. This action aims to break down societal taboos and promote discussions around reproductive rights and women's healthcare choices. Additionally, the mention of Aontú, an organization established in 2019 with a staunch anti-abortion stance, provides context on the diverse viewpoints and debates surrounding the legalization of abortion."
1467,Legalization_of_Abortion,"If Doctors used guns to perform abortions, would liberals then be opposed? #2A #liberallogic #SemST",AGAINST,"Expanding the sentence ""{text}"" to restated text, based on the provided information from Wikipedia:
""It is the argument against the anti-abortion movement.""
Expanded: This statement represents the stance opposing organizations and individuals who advocate against the legalization of abortion services.

Adding background information:
Legal abortion remains a contentious and polarizing issue within society, with ongoing debates concerning whether to expand or restrict access to abortion services. Additionally, there are internal disagreements among abortion-rights advocates regarding the specific types of abortion procedures that should be permitted, including considerations such as late-term abortions. The legal battles surrounding abortion have resulted in significant challenges for healthcare professionals, including threats to their medical licenses and potential legal consequences for providing abortion services."
1468,Legalization_of_Abortion,@SaculSacul @GVPrayerWarrior No guarantee she will be destroyed I trust God. #SemST,NONE,"The background information related to the text highlights the historical context and controversies surrounding the legalization of abortion. It mentions the perspective that women, including working women, should have the choice to become pregnant and terminate their pregnancy, especially in difficult circumstances. The case of Gerri Santoro in 1964, who died trying to obtain an illegal abortion, underscored the risks associated with restricted access to safe abortions. The text also alludes to differing views on abortion among rulers and the ongoing struggle for women's rights, with negotiations and arguments shaping the discourse."
1469,Legalization_of_Abortion,I don't hate LGBT but I disagree with same-sex marriage. #SacramentofMatrimonyisSacred #SemST,NONE,"The argument against the anti-abortion movement highlights the ongoing debate over the legalization of abortion, which continues to be a divisive issue in society. Various organizations emerged in the late 1960s to advocate for or against abortion rights. Different rulers and countries have held differing views on abortion, with countries like Argentina, a historically Catholic nation, facing protests against restrictive abortion laws. The fight for women's rights, especially in relation to abortion, has been characterized by extensive advocacy efforts and debates."
1470,Legalization_of_Abortion,"We all have a duty to protect the sanctity of life...from the first cell division, to the last. #ProtectLife #pjnet #ctot #ccot #SemST",AGAINST,"The sentence you provided seems to express a stance against the legalization of abortion. The historical background information related to this stance includes the notion of guilt associated with committing abortion, as well as the distinction between murder and abortion under certain laws like the Infant Life Preservation Act. Additionally, the mention of different views held by rulers throughout history and the establishment of anti-abortion groups such as Aontú adds further context to the discussion on the legalization of abortion."
1471,Legalization_of_Abortion,When Laws are passed by SCOTUS that defy a Gods laws it is always the children who suffer. God bless the children. #promarriage #SemST,AGAINST,"The sentence provided seems to be in support of the legalization of abortion as it focuses on arguments against the anti-abortion movement. Background information from the provided text includes the suggestion that abortion laws should include exemptions for cases of sexual assault or when the baby's quality of life is questionable. Additionally, it mentions a variety of abortion laws that have been established and the perspectives of different rulers throughout history on the topic of abortion."
