index,target,text,label,background
984,Legalization_of_Abortion,Just laid down the law on abortion in my bioethics class. #Catholic #SemST,AGAINST,"The sentence ""Legalization of Abortion"" aims at advocating for the allowance of abortion in legal frameworks. In the past, experts highlighted the importance of creating abortion laws that consider exemptions for cases of sexual assault or potential health issues for the fetus. These discussions reflect the ongoing societal and religious debates around abortion, with influences from organizations like the Catholic Church impacting the acceptability of abortion in certain regions like Poland."
985,Legalization_of_Abortion,@tooprettyclub Are you OK with #GOP males telling you what you can and can't do with your own body? #SemST,FAVOR,"The sentence ""This movement attempts to establish a right for women to make the choice to have an abortion without fear of legal and/or social backlash"" aligns with the ongoing advocacy for abortion rights, where groups like ShoutYourAbortion are working to normalize and destigmatize the procedure. Anti-abortion groups have been countered by organizations like ASAP, which advocate for reproductive autonomy and access to safe abortions globally. The 67% majority in favor of repeal reflects a growing shift in public opinion towards supporting women's rights to make decisions about their own bodies."
986,Legalization_of_Abortion,"If you don't want your kid, put it up for adoption. #sorrynotsorry #SemST",AGAINST,"The sentence initially provided seems to be a statement against the legalization of abortion, suggesting that the woman who commits the act is considered guilty, regardless of the circumstances. Referring to the background information, experts have recommended exemptions in abortion laws for cases of sexual assault or when the baby may have a poor quality of life. Additionally, the concept of child destruction involved taking the life of a viable unborn child before it becomes independent of its mother. This ties into the argument for giving women the agency to make decisions about motherhood. In contrast, there are cases where extreme fetal abnormalities could be a consideration for abortion, concerning serious physical or mental handicaps in the child."
987,Legalization_of_Abortion,"@RedAlert -there should be a ""stigma"" to butchering pre-born children - its a horrendous crime against humanity.  #murder #SemST",AGAINST,"The sentence regarding the legalization of abortion seems to touch upon the argument against the anti-abortion movement. Information related to the topic from Wikipedia provides insight into the different perspectives surrounding abortion laws, such as exemptions for cases of sexual assault or fetal abnormalities. It also discusses the blurred line between murder and abortion, as defined in the Infant Life Preservation Act. Additionally, the use of hashtags like #ShoutYourAbortion has been suggested to combat the stigma around abortion. This information adds context to the stance on abortion legalization."
988,Legalization_of_Abortion,But isn't that the problem then. Not enough faith. #gaystapo #socialism #SemST,NONE,"The sentence ""Advocates are challenging the law to put into perspective the negative factors this abortion ban brings"" reflects the ongoing debate surrounding the legality of abortion. This discussion is fueled by various factors, such as the influence of the Catholic Church in countries like Poland and Argentina, where abortion is often seen as socially unacceptable due to religious beliefs. The Asia Safe Abortion Partnership (ASAP) also plays a role in advocating for safe abortion practices to address the negative consequences of unsafe abortions on women's health and societal productivity."
989,Legalization_of_Abortion,Life is our first and most basic human right. #SemST,AGAINST,"The organizations working towards altering abortion laws and expanding family planning services in sub-Saharan Africa and the developing world include Sexual and Reproductive Rights Forum, Womenlink, Women with Disabilities Empathy Russia, and others. Anti-abortion groups, represented by organizations like Aontú, primarily focus on protecting the right to life and believe in restricting the access to abortion. These groups advocate for women's rights to equality, dignity, and reproductive autonomy, leading to debates around the accessibility and affordability of abortion services globally."
990,Legalization_of_Abortion,Rise & Shine its a new day & you're alive. Thank God 4 another day of precious life. #Christian #Catholic #TeamJesus #SemST,AGAINST,"The hashtag #ShoutYourAbortion gained traction as a way for women to share their positive abortion experiences and combat the stigma surrounding the topic. Additionally, advocacy groups like ASAP's ""Youth champions"" work to educate young people about sexual activity, reproductive health, and abortion rights. Various organizations such as Center for Health and Social Change, Femidangdang, Femimonsters, and Flaming Feminist Action advocate for abortion rights, while groups like Aontú are firmly against abortion and prioritize protecting the right to life. Different historical rulers had varying perspectives on abortion, reflecting diverse attitudes towards the issue throughout history."
991,Legalization_of_Abortion,Lmao my school thinks giving women the right to an abortion is against feminism. They don't know feminism #wtf #SemST,FAVOR,"The sentence ""Legalization of Abortion"" can be expanded and restated as follows: Advocating for the legalization of the voluntary termination of pregnancy as a woman's right to choose without facing legal or social repercussions. The history of abortion dates back to ancient Egyptian medicine and has been championed by feminist movements throughout the centuries. In recent times, groups like ShoutYourAbortion and The Joint Action for Reproductive Justice have emerged to amplify the voices advocating for legal access to abortion and reproductive rights."
992,Legalization_of_Abortion,@AsaSoltan putting abortion in with choices for women just won my heart over. Yaaaaaas! #shahs #SemST,FAVOR,"The legal movement for the legalization of abortion aims to grant women the right to choose abortion without facing legal or social repercussions. It is supported by initiatives like the Asia Safe Abortion Partnership (ASAP), which works to ensure safe and accessible abortion services and advocates for reproductive autonomy. The hashtag #ShoutYourAbortion was used to challenge the stigma surrounding abortion and promote positive narratives. Anti-abortion groups have faced opposition from ASAP, which has a global presence advocating for women's abortion rights in countries like Afghanistan, Thailand, China, and Lebanon."
993,Legalization_of_Abortion,Last meeting of the year tonight! 7:00 pm in Case Hall room 334A. Come one come all! Pizza and pop will be provided! #SemST,NONE,"The text mentions the importance of legalizing abortion and the significance of organizations such as ALRA (Abortion Law Reform Association), ASAP (Access to Safe Abortion Project), and abortion-rights advocate groups like Center for Health and Social Change. This suggests a broader context of historical movements promoting women's reproductive rights and the ongoing activism for safe and accessible abortions. Additionally, Aontú, founded in 2019, represents the opposing view as an anti-abortion organization, reflecting the diversity of opinions and advocacy within the broader discourse on abortion rights."
994,Legalization_of_Abortion,"FACT: 17% of today's population is equivalent to residents in New York, Florida, and Pennsylvania.  Where's the outrage for this?  #SemST",NONE,"The target sentence regarding the legalization of abortion relates to the prevalent issue of abortion policies and rates, particularly in Asia. TRAP (Targeted Regulation of Abortion Providers) policies are in effect in 26 states in the U.S. Asia has seen a significant number of abortions, with the majority occurring in Central and South Asia, notably in India and China. The context provided highlights the global scale of the abortion debate and the varying approaches and statistics across different countries."
995,Legalization_of_Abortion,They say God isn't listening? Just look at that radar today. #prayfornepal #SemST,NONE,"The legalization of abortion is a contentious issue that policymakers in twelve states have viewed as a means to declare abortion services non-essential, leading to their discontinuation. The Asia Safe Abortion Partnership (ASAP) was established to address the lack of access and inadequate healthcare for women seeking abortions in countries like Afghanistan, Thailand, China, and Lebanon. The rejection of proposals to remove suicide risk as a ground for abortion in referendums in 1992 and 2002 highlights the ongoing debate and challenges surrounding abortion rights. Additionally, the influence of the Catholic Church in countries like Poland and Argentina has contributed to the social stigma and opposition to abortion in these regions."
996,Legalization_of_Abortion,If you believe in its power; then pray. #Nepal #Baltimore #ISIS #Kenya #GenderChange #Injustice #Slavery #Racism #MiddleEast #SemST,NONE,"The text refers to the efforts of international organizations focused on altering abortion laws and expanding family planning services in sub-Saharan Africa and the developing world. One such organization mentioned is ASAP, which has mobilized a feminist movement advocating for women's abortion rights, autonomy, and dignity globally. The text also highlights how countries like Afghanistan, Thailand, China, and Lebanon have been influenced by ASAP's feminist advocacy efforts. Additionally, the mention of abortion rights advocate groups and the varied stance on abortion laws in the Middle East provide context for the ongoing global debate surrounding the legalization of abortion."
997,Legalization_of_Abortion,Planned Parenthood lines its pockets while sacrificing women and children in need at the altar of abortion. #SemST,AGAINST,"The background information from the Wikipedia text is important in understanding the context of the sentence. The Abortion rights movement advocates for women's autonomy to choose to terminate a pregnancy. ShoutYourAbortion was created in response to attempts to defund Planned Parenthood, emphasizing the legal right to abortion. International organizations work to improve access to safe abortion and family planning services worldwide. The text discusses the impact of unsafe abortions on women's health and economic well-being. Anti-abortion groups face opposition from organizations like ASAP, which support women's reproductive autonomy globally. Additionally, the availability and quality of abortion services vary, even where legal, such as in Asia."
998,Legalization_of_Abortion,It is not progressive to try to resolve problems by eliminating a human life. - #PopeFrancis #SemST,AGAINST,"The stance against the legalization of abortion is evident in the resistance to liberalizing access to legal abortion services, as seen through movements like Aontú. The influence of the Catholic Church in Poland has contributed to the social unacceptability of abortion in the country, and this is further perpetuated by the Pope's influence on public opinion. The debate over abortion rights is complex, with differing views on the autonomy, affordability, and effectiveness of termination of pregnancy services."
999,Legalization_of_Abortion,"RT @TheKeyisPrayer: ""No law can give me the right to do what is wrong.""  -Abraham Lincoln #SemST",AGAINST,"The movement for the legalization of abortion aims to grant women the right to choose abortion without facing legal or social repercussions. It traces back to discussions from the 1800s, where arguments were made that anti-abortion laws alone would not address the underlying issues. South Korea has had various rulers with differing perspectives on abortion, and historical rules were enforced to uphold respect for God and the church."
1000,Legalization_of_Abortion,We live in a world where people care more about religious rights than consent & reproductive rights.... #SemST,FAVOR,"The sentence provided, ""This movement attempts to establish a right for women to make the choice to have an abortion without fear of legal and/or social backlash,"" aligns with the ongoing global efforts by abortion-rights international organizations to advocate for the legalization and accessibility of abortion services. The fight for women's reproductive autonomy has faced opposition from anti-abortion groups, but organizations like ASAP have been instrumental in promoting the women's movement for abortion rights across multiple countries. Additionally, the issue of induced abortion remains a contentious topic in public discourse, with debates centering on whether to liberalize or restrict access to legal abortion services."
1001,Legalization_of_Abortion,we remind ourselves that love means to be willing to give until it hurts - Mother Teresa #SemST,AGAINST,"The background information related to the text touches on the historical context and struggles surrounding abortion. It outlines the societal pressures and legal ramifications faced by women seeking abortions, such as the tragic case of Gerri Santoro in 1964. Additionally, it mentions the use of social media platforms, like the hashtag #ShoutYourAbortion, in an effort to combat the stigma associated with abortion and promote awareness of women's rights to choose. Irrelevant information could involve unrelated abortion laws in different countries or statistics not directly tied to the topic at hand."
1002,Legalization_of_Abortion,"Life, what a beautiful choice. Adoption. Not abortion. #SemST",AGAINST,"The movement for the legalization of abortion aims to grant women the right to choose to have an abortion without facing legal or social repercussions. Experts have recommended that abortion laws include provisions for exceptions, such as in cases of sexual assault or when the baby may have a poor quality of life. Advocates argue that allowing women to make choices about their pregnancies gives them autonomy and the ability to decide whether they want to become mothers or not. Additionally, the #ShoutYourAbortion hashtag was created to encourage women to share their positive abortion experiences online and challenge the stigma surrounding abortion."
1003,Legalization_of_Abortion,My teacher today basically said that embroyo's are nothing but skin + blood & that abortion was fine. #smartlady #SemST,FAVOR,"The provided text highlights the argument against the anti-abortion movement and the experts advocating for exemptions in abortion laws. It mentions the importance of providing options for women who have been sexually assaulted or whose babies may face challenges in life. Furthermore, it discusses the right to abortion until viability as determined by the doctor. Background information suggests that the debate around abortion often involves considerations of women's rights, medical ethics, and social implications."
1004,Legalization_of_Abortion,"@ShowTruth Keeping pregnant people safe is a great reason for abortion, though. #SemST",FAVOR,"In the context of the stance testing on the legalization of abortion, the provided sentence advocates for the position of legalizing abortion. The text suggests that abortion laws should include exemptions for women who have been sexually assaulted or in cases where the baby's quality of life may be at risk. Additionally, it mentions the importance of women having the right to choose to terminate a pregnancy, especially in challenging work conditions. This aligns with the ongoing debate on abortion rights and reflects a perspective that aims to support women's reproductive autonomy."
1005,Legalization_of_Abortion,@rosaryrevival When we #PrayTheRosary lest we forget to #Prayforpersecutedchurch #PrayForIsrael #PrayForUkraine #SemST,NONE,"The text mentions the hashtag #ShoutYourAbortion, which was used by women to share their positive abortion experiences online in order to combat the stigma surrounding abortion. This initiative was supported by organizations such as the Center for Health and Social Change and Womenlink. In conservative Catholic countries like Poland and Argentina, where the Church has strong influence, abortion remains a socially taboo and contentious issue, leading to protests and activism for abortion rights."
1006,Legalization_of_Abortion,#cogar @RefCom_ie get more #questions on #d #ballott! #ireland's #dail is stuck. We'll #help! #drugswar #landwar #etc. #tanks #SemST,NONE,"The issue of induced abortion is a continuing debate in public life, with opposing perspectives on whether to expand or restrict access to legal abortion services. In Ireland, mainstream center-right parties like Fianna Fáil and Fine Gael take a stance that allows a conscience vote on abortion rights in specific situations, rather than having official policies. Recent developments include the set up of a citizens assembly and proposals, supported by a diverse political committee, advocating for the repeal of the 8th Amendment and unrestricted access to abortion within the first 12 weeks of pregnancy, with exceptions for cases of fatal foetal abnormalities, rape, and incest. This movement for reform was backed by the cross-society group Together for Yes, which played a significant role in the campaign for the repeal of the 8th Amendment in a referendum."
1007,Legalization_of_Abortion,"Yep. RT: ""Defunding PP won't mean fewer abortions. It will mean more dead women. #prochoice"" #1in3 #SemST",FAVOR,"The provided text illustrates the argument against the anti-abortion movement, emphasizing that simply passing an anti-abortion law would not address the root issues. The launch of ShoutYourAbortion in 2015 aimed to highlight the legal right to abortion and acknowledge the negative consequences of unsafe abortions on women's health, productivity, and financial stability. The high support for repealing abortion bans reflects the importance of stories shared by women advocating for changes in reproductive rights legislation."
1008,Legalization_of_Abortion,"@mrprolife You would force a woman to risk her health, sanity, and life, to continue a doomed pregnancy. Against her will. No. #SemST",FAVOR,"The text ""It is the argument against the anti-abortion movement"" refers to the stance supporting the legalization of abortion, which advocates for women's right to choose to have an abortion without facing legal or social consequences. The history of the abortion rights movement involves a strong belief in giving working women the choice to terminate pregnancies under challenging circumstances. The movement emphasizes the negative consequences that may follow if women are unable to make decisions about their own pregnancies, and highlights the risks associated with illegal abortions. Anti-abortion groups argue that restrictions on abortion are necessary for the safety of the mother and child, despite the lack of scientific evidence supporting this claim."
1009,Legalization_of_Abortion,Whether someone wants to have children or not should be completely up to the person carrying that pregnancy... #SemST,FAVOR,"The sentence ""She came to strongly believe that working women should have the choice to become pregnant and to terminate their pregnancy while they worked in the horrible circumstances surrounding a pregnant woman who was still required to do hard labor during her pregnancy"" highlights a key aspect of the Abortion rights movement's goal to give women the agency to make decisions about their pregnancies. This stance emphasizes the importance of women having control over their reproductive rights, especially in challenging or unsafe working conditions. The movement advocates for the autonomy, affordability, and effectiveness of accessing abortion services for pregnant women, emphasizing humanitarian rights and the right to choose throughout the full duration of the pregnancy."
1010,Legalization_of_Abortion,I will agree to gay marriage if you agree to pro-life and then adopt babies that would have been aborted. #SemST,AGAINST,"The sentence ""Legalization of Abortion"" pertains to the broader context of the abortion rights movement seeking to represent and support women who desire to end pregnancies. It counters arguments from the anti-abortion movement. Advocates emphasize that simply passing anti-abortion laws could be likened to addressing symptoms rather than root causes. Experts recommend that abortion laws should include exemptions for cases of sexual assault or where a baby's quality of life may be a concern. The Asia Safe Abortion Partnership is an organization focused on safe abortion practices in the region."
1011,Legalization_of_Abortion,"On Manila TV,Monday: #Pacquiao appeals to @IndonesiaPresident -don't execute #MaryJaneVeloso #deathRow #drugTrafficking #Christian #SemST",NONE,"The Asia Safe Abortion Partnership (ASAP) was established with the aim of supporting countries like the Philippines, Iraq, and Laos where abortion is not legal except for certain exceptions. In South Korea, advocacy groups like the Center for Health and Social Change, Femidangdang, Femimonsters, and Flaming Feminist Action have mobilized efforts to legalize abortion through petitions and campaigns. Following the tragic case of Savita Halappanavar in 2012, activists have sought to repeal the eighth amendment and highlight the importance of safe and legal abortion through social media campaigns."
1012,Legalization_of_Abortion,Too far? Sorry so is he #SemST,NONE,"Based on the provided information related to abortion, it is crucial to mention that there are ongoing efforts by organizations like Asia Safe Abortion Partnership (ASAP) to promote women's reproductive autonomy and access to safe abortion services across various countries. These efforts have faced opposition from anti-abortion groups, but the movement for abortion rights continues to be a strong force in nations like Afghanistan, Thailand, China, and Lebanon. Additionally, it is worth noting that as of the end of 2020, abortion laws in Great Britain allow termination of pregnancy up to 24 weeks under certain circumstances, such as when the life of the pregnant woman is at risk."
1013,Legalization_of_Abortion,I watched #AfterTiller and it gave me a whole new perspective on a woman's right to choose. #womensRights #SemST,FAVOR,"The movement pushing for the legalization of abortion is aimed at granting women the right to choose to have an abortion without facing legal or social consequences. Advocates use platforms like Twitter to share positive abortion experiences using the hashtag #ShoutYourAbortion, in an effort to break the stigma surrounding abortion. This ongoing fight for women's reproductive rights includes efforts to increase accessibility to safe and legal abortion services and post-abortion care."
1014,Legalization_of_Abortion,@explicit0ceans I don't either. Why would you want to make people have kids? Esp when they're not prepared? Makes no sense. #SemST,FAVOR,"Based on the provided text, the legal and moral arguments against anti-abortion movements are highlighted, stressing the guilt associated with committing abortion regardless of the motive. Experts advocate for exemptions in abortion laws for cases of sexual assault or when the unborn baby may face a poor quality of life. It is emphasized that women should have the autonomy to choose whether to continue a pregnancy while considering their own circumstances and well-being. Additionally, the high rate of unwanted pregnancies in the Dominican Republic, often resulting from incest or rape, serves as a crucial context for understanding the urgency of legalizing abortion to address women's reproductive rights and choices."
1015,Legalization_of_Abortion,True progressives work toward greater inclusion and protections for the marginalized. Standing up for the unborn is progressive! #SemST,AGAINST,"The Abortion rights movement advocates for women's rights to terminate their pregnancies without facing legal or social consequences. International organizations are actively working to change abortion laws and increase access to family planning services in sub-Saharan Africa and the developing world. Various advocacy groups, such as the Center for Health and Social Change and Femidangdang, support the movement for abortion rights, emphasizing the importance of autonomy, affordability, and effectiveness in accessing termination of pregnancy services."
1016,Legalization_of_Abortion,MT @ProLifePolitics- Senate vote on SC Pain-Capable Unborn Child Protection Act could come as early as Wed. Contact your senators! #SemST,AGAINST,"The sentence refers to the legalization of abortion, and it highlights the specific provisions proposed by a cross-party Oireachtas committee in Ireland, such as repealing the 8th Amendment, allowing unrestricted access to abortion for the first 12 weeks of pregnancy, and permitting no-term limits for special cases like fatal foetal abnormalities, rape, and incest. It also mentions how activists used social media to amplify the voices of women during the campaign to repeal the Eighth Amendment. The information provided in the background discusses the timeline of events leading to the legalization of abortion in Ireland, including the approval of abortion up to 12 weeks in October 2019 and the passing of a bill legalizing abortion up to 14 weeks after conception in December 2020. This context adds depth to the process and progress made towards the legalization of abortion in Ireland."
