index,target,text,label,background
1664,Legalization_of_Abortion,Like how can you sit there and even go through with the process #SemST,NONE,"The sentence provided seems to discuss the importance of allowing women the choice to have an abortion. It mentions the historical context of illegal abortions and the risks and stigma associated with the procedure. Additionally, it touches on the use of hashtags like #ShoutYourAbortion to challenge societal views on abortion. It refers to the struggles faced by pregnant working women who seek to terminate their pregnancies. This emphasizes the need for legalizing abortion to ensure safe and accessible options for women in such situations."
1665,Legalization_of_Abortion,"Fair IS fair if U believe an unborn child has no right to life, then UR saying I can decide if you do?? #SemST",AGAINST,"The sentence ""{text}"" expanded would be: ""It is the argument against the anti-abortion movement."" 
Based on the information related to the topic of abortion, it is valuable to know that the debate often revolves around establishing a woman’s right to choose to have an abortion without facing legal or social consequences. Some argue for exemptions in abortion laws for cases of sexual assault or fetal abnormalities. Additionally, there are discussions on the distinction between murder and abortion under laws such as the Infant Life Preservation Act. The debate also includes considerations of pregnant working women and their right to make reproductive choices in various circumstances."
1666,Legalization_of_Abortion,@MichestBlogSpot: Postinor is popularly  used for?  #MrChocho_BabyOKoko #SemST,NONE,"Certainly. The use of birth control methods for pregnancy prevention has gained popularity, especially after a significant case involving a fourteen-year-old rape victim who received a pregnancy termination. Women have started sharing their positive abortion experiences online with the hashtag #ShoutYourAbortion to combat the associated stigma. Additionally, the drug misoprostol is increasingly being used for abortions in Asian countries. The creation of ""youth champions"" by ASAP underscores the importance of educating young people about sexual health, reproductive rights, and the abortion rights movement."
1667,Legalization_of_Abortion,#FF #Patriot --> PigsWalkUpright.  Thanks 4 following back!! #Truth #Liberty #Justice #ProIsrael #2A #RiseUpAmerica #ProudAmerican #SemST,NONE,"The labels ""pro-choice"" and ""pro-life"" are commonly used in the discourse on abortion, reflecting values such as liberty and freedom. The tragic death of Gerri Santoro in 1964 while attempting an illegal abortion helped to highlight the need for abortion rights. Various advocacy groups like the Center for Health and Social Change and the Abortion Rights Campaign are involved in promoting abortion rights around the world, including in countries like Ireland and Poland. It's worth noting that there are also anti-abortion groups, like Aontú in Ireland, actively working against the legalization of abortion."
1668,Legalization_of_Abortion,"How many location-efficient, #affordablehousing units could the NYC metro (pop. 23M) create if it built over all of its cemeteries? #SemST",NONE,"The legalization of abortion is a contentious topic globally. In the 1960s, groups like ""Jane"" in Chicago operated floating abortion clinics to provide access to abortion services. TRAP policies, implemented by 26 states, aim to restrict access to abortion. Some policymakers have deemed abortion as non-essential, leading to the cessation of services in twelve states. Programs like ASAP are working to increase access to safe and legal abortions and post-abortion healthcare. In countries like China and Russia, significant differences in abortion rates can be observed, influenced by historical contexts such as the legality of abortion in the past."
1669,Legalization_of_Abortion,"@nytimes while you are at it, eliminate all drugs, cars, planes, food, electricity, and anything else that MAY cause a death. #SemST",NONE,"The sentence ""After the death of Savita Halappanavar in 2012, there has been a renewed campaign to repeal the eighth amendment and legalize abortion"" refers to a significant event in Ireland. Savita Halappanavar died due to complications from a septic miscarriage after being denied an abortion, sparking a movement to change Ireland's strict abortion laws. The eighth amendment in Ireland previously enshrined a near-total ban on abortion in the country, leading to calls for its repeal and the legalization of abortion to ensure women's health and rights are protected."
1670,Legalization_of_Abortion,"Not all women want to have or bear children, and that is okay  #SemST",FAVOR,"The movement advocating for the legalization of abortion seeks to ensure women have the right to choose abortion without facing legal or social repercussions. Experts recommend that abortion laws include exemptions for cases of sexual assault or when a baby would have a diminished quality of life. This issue highlights the importance of giving women autonomy over their reproductive decisions, regardless of societal norms or pressures. Online campaigns like #ShoutYourAbortion aim to break the stigma associated with abortions and foster a supportive community for women sharing their stories. The ongoing struggle for women's rights, particularly in relation to abortion, involves extensive debates, negotiations, and exceptions."
1671,Legalization_of_Abortion,"Meanwhile, @JustinTrudeau wants to waste your money to kill innocent children in the womb. #dangerous #hypocrite #noChoice #SemST",AGAINST,"The sentence ""It is the argument against the anti-abortion movement"" can be expanded to say that there are individuals or groups opposed to the anti-abortion movement. The stance argues for the legalization of abortion and may involve advocating for women's reproductive rights. This aligns with initiatives like ShoutYourAbortion, which aim to highlight abortion as a legal right for those who choose or need it. The push for legalized abortion faces challenges, such as unsafe procedures leading to health risks and economic burdens on families. The topic of abortion has sparked discussions within political parties like the Conservative Party, showing varying viewpoints on abortion policies."
1672,Legalization_of_Abortion,"If we are pronounced dead when our heart stops, why are we not pronounced alive when our heart starts? #SemST",AGAINST,"The given sentence emphasizes the emotional and moral dilemmas faced by women when seeking abortion. The Infant Life Preservation Act distinguishes between intentional killing (murder) and inducing a miscarriage (abortion). The You Know Me movement arose in response to the passage of restrictive abortion laws in multiple U.S. states, including Georgia, Ohio, and Alabama in 2019. Historically, concerns around abortion in the mid-19th century were related to health risks rather than religious or ethical reasons. The death of Savita Halappanavar in 2012 reignited efforts to repeal the eighth amendment in order to legalize abortion in Ireland."
1673,Legalization_of_Abortion,89% of abortions occur at the 12th week or before #letstalkabortion #SemST,NONE,"The sentence you provided talks about the legalization of abortion. In some countries, laws restrict abortions based on gestational age, race, and specific pregnancy conditions. Abortion rates are high in Central and South Asia, with millions of procedures performed in countries like India and China. Different countries have varying laws regarding abortion, with some legalizing it up to a specific gestational age limit. In Argentina, for example, after a lengthy debate in 2020, the Chamber of Deputies approved a bill legalizing abortion up to 14 weeks after conception."
1674,Legalization_of_Abortion,1.2% of abortions happen at 21 weeks+  (these are only exceptions) #letstalkabortion #SemST,NONE,"The sentence ""Legalization of Abortion"" refers to the ongoing debates and changes in laws around the world regarding the termination of pregnancies. In various countries, abortion laws are being updated to include exemptions for cases of sexual assault and fetal abnormalities. For example, in some regions in Asia, up to 27% of pregnancies end in abortions. Recent developments, such as the legalization of abortion up to 12 or even 14 weeks after conception, reflect the evolving stances on this controversial issue."
1675,Legalization_of_Abortion,#NothingMoreAmericanThan unjustified homicide of the unborn in #SemST,AGAINST,"The sentence provided focuses on the argument against the anti-abortion movement, advocating for the legalization of abortion to allow women to choose without fear of legal or social repercussions. The history of the abortion rights movement in the United States dates back to the 1960s, where tragic incidents like Gerri Santoro's death highlighted the dangers of illegal abortions. The death of Savita Halappanavar in 2012 sparked renewed efforts to repeal restrictive abortion laws, showcasing the ongoing debate surrounding women's reproductive rights and access to safe healthcare options."
1676,Legalization_of_Abortion,Generate belief in quality existence for everyone especially children in that community.Kittington2016 #SemST,AGAINST,"The sentence underlying the legalization of abortion centers around the importance of providing exemptions for cases of sexual assault and fetuses with potential quality-of-life issues. The #ShoutYourAbortion hashtag was used to encourage women to share positive abortion stories, aiming to combat the stigma associated with abortion. Additionally, youth champions from ASAP have been trained to educate their peers on sexual activity, abortion rights, and reproductive health, contributing to the broader movement for reproductive and sexual rights within the human rights sphere."
1677,Legalization_of_Abortion,"When Declaration of Independence was adopted, abortion was illegal in all 13 colonies. #txlege #SemST",AGAINST,"Between 1900-1965, there were no anti-abortion movements or rallies as states had laws banning abortions at all levels. The Wade verdict changed abortion laws, legalizing it and establishing laws banning specific abortion methods. In different countries, such as the Republic of Ireland and the United Kingdom, abortion laws vary based on circumstances. In the Republic of Ireland, abortion was only allowed if the woman's life was in danger, while the United Kingdom legalized abortion on multiple grounds."
1678,Legalization_of_Abortion,I'm really pissed off by vaccines mandates. It's not ok to force parents to inject their kids when there might be consequences. #SemST,NONE,"The text seems to discuss the argument against the anti-abortion movement, highlighting the negative consequences that can occur if women are unable to terminate pregnancies of their own choosing, such as suicide, injury, and blood-poisoning. Many healthcare professionals faced risks and consequences for providing abortions, and even the mother herself could face punishment for attempting to abort a fetus. The situation in South Korea mentions dangerous self-induced abortions due to the abortion ban, prompting advocates to challenge the law and bring attention to its negative impact."
1679,Legalization_of_Abortion,Please vote against the anti-choice amendment to the Scotland Bill on Monday @KevinBrennanMP - Thanks! #abortionrights #SemST,AGAINST,"The argument against the anti-abortion movement is in support of abortion rights. The organization Aontú, established in January 2019, is firmly against abortion and aims to protect the right to life. Their proposals, which have broad support, include repeal of the 8th Amendment, allowing unrestricted access to abortion up to 12 weeks of pregnancy, and no-term limits for special cases like fatal foetal abnormalities, rape, and incest. Together for Yes, an advocacy group formed from various organizations, was the official campaign group for the referendum on repealing the 8th Amendment in Ireland."
1680,Legalization_of_Abortion,@notmuchelse But of course today one doesn't have to be responsible You can kill your child instead! #SemST,AGAINST,"The text strongly condemns abortion, viewing it as a grave sin with severe consequences for both the woman and the unborn child. It mentions the historical term ""child destruction"" to describe the act of ending the life of a viable unborn child. Legal restrictions and bans on abortion have led to unsafe procedures and practices, putting women's health at risk. The criteria for accessing abortion are broad, making it effectively available on demand with the approval of two National Health Service doctors."
1681,Legalization_of_Abortion,Those who wonder what they would have done had they lived at the time of some terrible injustice now know the answer -P. Hitchens #SemST,AGAINST,"The statement ""Anthony, an anonymous contributor signing 'A' wrote in 1869 about the subject, arguing that instead of merely attempting to pass a law against abortion, the root cause must also be addressed."" reflects the historical context of the abortion debate. It highlights the discussion around addressing the root causes rather than just implementing laws against abortion. The mention of a pregnant working woman subjected to hard labor speaks to the harsh realities faced by women historically in such situations. The reference to the Russian Penal Code of 1462-1463 sheds light on the severe consequences faced by women seeking abortion during that time period."
1682,Legalization_of_Abortion,"Damn, interesting news when you find out you were almost a product of abortion #SemST",AGAINST,"The sentence mentions ""#ShoutYourAbortion,"" which was a social media campaign encouraging women to share positive abortion experiences. This movement aimed to destigmatize abortion and promote women's reproductive rights. Additionally, the mention of the case of Gerri Santoro highlights the dangers women faced seeking illegal abortions before legalization. The various factors mentioned, such as rape, incest, and the health of the mother, reflect the complexity of the abortion debate."
1683,Legalization_of_Abortion,Reading law cases on abortion rulings from the past 100 years is exhausting! #research #workhard #work #publichealth #SemST,AGAINST,"The issue of legalizing abortion involves ongoing debates between those advocating for liberalization and those favoring restrictions on access to abortion services. Courts and prosecutors have historically harassed physicians providing abortions and women seeking abortions. The number of abortion laws passed between 2011 and 2019 has significantly limited access to safe abortion procedures, leading to dangerous self-induced and illegal practices. Advocates continue to challenge these laws in defense of women's rights and choice in abortion."
1684,Legalization_of_Abortion,Every1 needs 2 c @Rick_Reyna & @rallysforchrist's movie #TheRallyLA. It's life transforming. #drugs #forgive #SWBC2015 #Salvation #SemST,AGAINST,"The abbreviation ""ASAP"" in the text stands for ""Abortion Service Access Program,"" a program aimed at increasing accessibility to safe and legal abortions and post-abortion health care. The protest mentioned involved advocates from various groups, such as ""The Joint Action for Reproductive Justice,"" pushing for the legalization of abortion in South Korea. This reflects a broader movement where different advocate groups, like the Center for Health and Social Change, come together to promote reproductive rights and push for legislative changes regarding abortion."
1685,Legalization_of_Abortion,@VeronicaCoffin @Fingersflying the irony of Margaret Sanger wanting to rid the world of blacks. #SemST,AGAINST,"The sentence mentions the legalization of abortion. It is key to note that Stella Browne, a prominent birth control advocate, transitioned into advocating for abortion rights in the 1930s. She believed in giving working women the choice to terminate pregnancies, especially highlighting the dangers of women being forced into hard labor while pregnant. This context sheds light on the historical struggle for abortion rights and the tragic consequences of illegal abortions, as seen in the case of Gerri Santoro in 1964. The mention of the group ""Jane"" operating a floating abortion clinic in Chicago during the 1960s showcases the grassroots activism and underground efforts to provide safe abortion services pre-legalization."
1686,Legalization_of_Abortion,"#rally4life Motherhood is for some much-wanted,for others it is not.It should be by choice, not by force. Respect women's choices #SemST",AGAINST,"The movement for the legalization of abortion aims to grant women the right to choose to have an abortion without facing legal or social repercussions. Women should have the freedom to decide whether to continue a pregnancy even while working under challenging conditions. Advocates believe that empowering women to make decisions about motherhood gives them control over their lives. The use of hashtags like #ShoutYourAbortion is a way to break the stigma surrounding abortion by sharing positive experiences. The fight for women's rights to abortion has been ongoing, involving negotiations, arguments, and exceptions. There is a link to the Anti-abortion movement, discussions on ""my body, my choice,"" and the importance of reproductive rights and voluntary childlessness."
1687,Legalization_of_Abortion,I hope you all either enjoy the rugby or enjoy not enjoying the rugby #SemST,AGAINST,"The sentence ""The women encouraged other women to share positive abortion experiences online using the hashtag #ShoutYourAbortion"" refers to a social media campaign aimed at normalizing and destigmatizing abortion. This campaign was seen as controversial by policymakers in twelve states who then attempted to restrict abortion services by deeming them non-essential. In Ireland, there are contrasting views on abortion, with Aontú being a firm anti-abortion group, while Together for Yes campaigned for the repeal of the 8th Amendment, which restricted abortion access. Argentina recently approved a bill legalizing abortion, showing a global shift in attitudes towards the issue."
1688,Legalization_of_Abortion,En route to Parnell Square for the rally for life!!  #everylifematters #SemST,AGAINST,"The background information related to the sentence about the legalization of abortion includes examples of organizations and political parties that have taken stances on the issue. Among these are Sinn Féin, the Labour Party, Social Democrats, and others who have official policies supporting abortion rights. On the opposing side, Aontú, founded in 2019, is staunchly anti-abortion. The coalition group Together for Yes played a key role in the campaign to repeal the 8th Amendment in Ireland."
1689,Legalization_of_Abortion,@Independent_ie No one has 5he right to tell any person what they should do with their body #SemST,AGAINST,"The movement seeking the legalization of abortion aims to grant women the right to choose abortion without facing legal or social repercussions. The debate on induced abortion is contentious, with arguments for both liberalizing and restricting access to abortion services. The existing abortion ban has resulted in risky self-induced abortions and illicit abortion practices, highlighting the need for more attention and accessible healthcare services. The criteria for abortion, based on risks to mental and physical health, can lead to abortion being available on demand with the consent of two National Health Service doctors. Additionally, proponents of abortion rights emphasize the importance of women's autonomy, affordability, and effectiveness in accessing abortion services throughout their pregnancy."
1690,Legalization_of_Abortion,@ProWomanChoice @BuhayIpaglaban people like you are exactly what is wrong with our society. #ProCONTRACEPTION #unapologetic  #SemST,AGAINST,"The movement advocating for the legalization of abortion aims to grant women the right to choose to terminate a pregnancy without facing legal or social repercussions. Unsafe abortions not only impact women's health but also impose financial strain on families. Anti-abortion groups have opposed reproductive autonomy, while organizations like ASAP work globally to support women's rights to access safe and legal abortions. Abortion-rights advocacy groups, such as the Center for Health and Social Change and Feminist Action groups, are prominent in the fight for abortion rights."
1691,Legalization_of_Abortion,A bundle of cells feels more pain than a fully grown women? no. #SemST,AGAINST,"The text you provided highlights the various ethical, legal, and health considerations surrounding abortion, including the experts' suggestions for exemptions in cases of sexual assault or fetal abnormalities. The reference to ""post-quickening"" refers to a historical perspective on the legality of abortion based on fetal movement. Additionally, the mention of complications resulting from the use of unsterilized instruments emphasizes the importance of safe and sterile medical practices in abortion procedures. Lastly, the consideration of extreme fetal abnormalities adds a layer of complexity to the ethical debate surrounding the legalization of abortion."
1692,Legalization_of_Abortion,pro-choicers are basically tryna fight oppression with more  oppression . #feminist #SemST,AGAINST,"The sentence provided seems to emphasize the opposition to the anti-abortion movement. The ASAP (Abortion Support and Action Project) is mentioned as having members spread across multiple countries advocating for abortion rights. The mention of groups like ""The Joint Action for Reproductive Justice"" reflects the collaborative efforts of feminist advocates to promote the legalization of abortion and draw attention to the need for change in related laws and policies. The background information highlights the global nature of the abortion rights movement and the ongoing struggle for women's autonomy in making decisions about their reproductive health."
1693,Legalization_of_Abortion,#rally4life more like rally for people who think they have the right to authorise other people's decisions #SemST,AGAINST,"The movement for the legalization of abortion seeks to grant women the right to choose abortion without facing legal or societal repercussions. It is commonly referred to as the ""pro-choice"" stance, emphasizing liberty and freedom, in contrast to the ""pro-life"" position. Initiatives like ShoutYourAbortion have been launched to assert the legality of abortion as a right. The significant support for the repeal of anti-abortion laws highlights the impact of personal stories shared online in influencing public opinion."
1694,Legalization_of_Abortion,"As a man, the only body I should have a say in is my own. #repealthe8th #rally4life #SemST",AGAINST,"""After the death of Savita Halappanavar in 2012, there has been a renewed campaign to repeal the eighth amendment and legalize abortion."" The death of Savita Halappanavar in 2012 due to being denied an abortion sparked a new movement advocating for the repeal of the eighth amendment in Ireland, which restricted access to abortion. 

""Their proposals, broadly supported by a cross-party Oireachtas committee, include repeal of the 8th Amendment, unrestricted access to abortion for the first 12 weeks of pregnancy and no-term limits for special cases of fatal foetal abnormalities, rape and incest."" The proposed changes to the laws regarding abortion in Ireland include the complete repeal of the eighth amendment, allowing unrestricted access to abortion up to the first 12 weeks of pregnancy, and no term limits for specific cases such as fatal foetal abnormalities, rape, and incest. 

""67% majority in favor of repeal is a testament to these stories and the women who braved the public Twitter sphere to change the law around women's reproductive lives."" The significant 67% majority vote in favor of repealing the eighth amendment in the referendum showcased the impact of personal stories shared by women advocating for change, especially on social media platforms like Twitter."
1695,Legalization_of_Abortion,Wish I could be at the #rallyforlife counter protest. Women are people. Fetuses are clumps of cells. End of story. #ireland #SemST,AGAINST,"The sentence provided refers to the argument against the anti-abortion movement and the advocacy for the legalization of abortion. In the Republic of Ireland, abortion was illegal except in cases where the woman's life was threatened, following the 1983 referendum known as the 8th Amendment. Two prominent groups related to the issue are Aontú, which is anti-abortion, and Together for Yes, which campaigned for the repeal of the 8th Amendment."
1696,Legalization_of_Abortion,"#rally4life because if they don't want an abortion, then no one can have the choice  #SemST",AGAINST,"The sentence you provided, ""The Abortion rights movement seeks out to represent and support women who wish to terminate their pregnancy at any point,"" refers to the advocacy efforts aimed at legalizing abortion and ensuring women can access it without facing legal or social consequences. This aligns with the push for exemptions in abortion laws for cases of sexual assault or fetal abnormalities. Additionally, the creation of the #ShoutYourAbortion movement in response to attempts to defund Planned Parenthood highlights the importance of destigmatizing discussions around abortion and promoting it as a legal right for those who choose it. In summary, these aspects highlight the ongoing debates and activism surrounding abortion rights and access."
